{
  "$schema": "./daily-updates.schema.json",
  "title": "Daily Updates",
  "subtitle": "Short, dated shipping notes — linked to docs, demos, or code.",
  "initial_visible": 6,
  "items": [
    {
      "date": "2026-01-10",
      "title": "PlatformService#431: Fix remaster",
      "url": "https://github.com/AceDataCloud/PlatformService/pull/431",
      "tags": [
        "github",
        "pr",
        "PlatformService"
      ]
    },
    {
      "date": "2026-01-10",
      "title": "Dify#51: fix: Fix plugin install issue and model initializer",
      "url": "https://github.com/AceDataCloud/Dify/pull/51",
      "tags": [
        "github",
        "pr",
        "Dify"
      ]
    },
    {
      "date": "2026-01-10",
      "title": "Dify#50: fix: Fix plugin auto install issue",
      "url": "https://github.com/AceDataCloud/Dify/pull/50",
      "tags": [
        "github",
        "pr",
        "Dify"
      ]
    },
    {
      "date": "2026-01-10",
      "title": "Dify#49: fix: Refine plugins",
      "url": "https://github.com/AceDataCloud/Dify/pull/49",
      "tags": [
        "github",
        "pr",
        "Dify"
      ]
    },
    {
      "date": "2026-01-10",
      "title": "Dify#48: feat: add seedream plugin",
      "url": "https://github.com/AceDataCloud/Dify/pull/48",
      "tags": [
        "github",
        "pr",
        "Dify"
      ]
    },
    {
      "date": "2026-01-10",
      "title": "Dify#47: feat: Add seedance plugin",
      "url": "https://github.com/AceDataCloud/Dify/pull/47",
      "tags": [
        "github",
        "pr",
        "Dify"
      ]
    },
    {
      "date": "2026-01-10",
      "title": "Dify#46: feat: Add Sora plugin",
      "url": "https://github.com/AceDataCloud/Dify/pull/46",
      "tags": [
        "github",
        "pr",
        "Dify"
      ]
    },
    {
      "date": "2026-01-10",
      "title": "Dify#45: feat: Add Kling plugin",
      "url": "https://github.com/AceDataCloud/Dify/pull/45",
      "tags": [
        "github",
        "pr",
        "Dify"
      ]
    },
    {
      "date": "2026-01-10",
      "title": "Dify#44: feat: Add suno plugin",
      "url": "https://github.com/AceDataCloud/Dify/pull/44",
      "tags": [
        "github",
        "pr",
        "Dify"
      ]
    },
    {
      "date": "2026-01-10",
      "title": "Dify#43: feat: Add luma plugin",
      "url": "https://github.com/AceDataCloud/Dify/pull/43",
      "tags": [
        "github",
        "pr",
        "Dify"
      ]
    },
    {
      "date": "2026-01-10",
      "title": "Dify#42: feat: Add Midjourney plugin",
      "url": "https://github.com/AceDataCloud/Dify/pull/42",
      "tags": [
        "github",
        "pr",
        "Dify"
      ]
    },
    {
      "date": "2026-01-10",
      "title": "Dify#41: feat: Add hailuo plugin",
      "url": "https://github.com/AceDataCloud/Dify/pull/41",
      "tags": [
        "github",
        "pr",
        "Dify"
      ]
    },
    {
      "date": "2026-01-10",
      "title": "Dify#40: feat: Add flux plugin",
      "url": "https://github.com/AceDataCloud/Dify/pull/40",
      "tags": [
        "github",
        "pr",
        "Dify"
      ]
    },
    {
      "date": "2026-01-10",
      "title": "Roadmap site published (static + JSON-configured)",
      "url": "https://github.com/AceDataCloud"
    },
    {
      "date": "2026-01-09",
      "title": "Docs: unified accounts and API key binding overview",
      "url": "https://platform.acedata.cloud/documents",
      "tags": [
        "docs"
      ]
    },
    {
      "date": "2026-01-08",
      "title": "Gateway: reliability dashboard draft (routing + cost visibility)",
      "url": "https://platform.acedata.cloud/services",
      "tags": [
        "gateway"
      ]
    },
    {
      "date": "2026-01-07",
      "title": "Dify integration notes: workflow backbone and account binding",
      "url": "https://platform.acedata.cloud/documents",
      "tags": [
        "workflows"
      ]
    },
    {
      "date": "2026-01-06",
      "title": "Nexior: open-source distribution layer highlight",
      "url": "https://github.com/AceDataCloud/Nexior",
      "tags": [
        "open-source"
      ]
    },
    {
      "date": "2026-01-05",
      "title": "Hub UX iteration plan for template-first use cases",
      "url": "https://hub.acedata.cloud",
      "tags": [
        "hub"
      ]
    },
    {
      "date": "2026-01-04",
      "title": "x402 settlement checklist for production workflows",
      "url": "https://platform.acedata.cloud/documents",
      "tags": [
        "payments"
      ]
    },
    {
      "date": "2026-01-03",
      "title": "Data services outline: ingestion → processing → delivery standards",
      "url": "https://platform.acedata.cloud/documents",
      "tags": [
        "data"
      ]
    }
  ]
}
